{
  "$schema": "https://json-schema.org/draft/2020-12/schema",
  "$id": "https://formspec.org/schemas/screener/1.0",
  "title": "Formspec Screener Document",
  "description": "A standalone Formspec Screener document for respondent classification and routing. A Screener is a freestanding routing instrument — it does not bind to a target Definition. Its relationship to Definitions is expressed entirely through route targets. A Screener declares screening items, binds evaluated in an isolated scope, and an ordered evaluation pipeline with pluggable strategies (first-match, fan-out, score-threshold, or extensions). Evaluation produces a Determination Record capturing matched routes, eliminated routes, scores, inputs with answer states, and evaluation metadata. Lifecycle primitives: availability windows, result validity durations, and evaluation version binding.",
  "type": "object",
  "required": [
    "$formspecScreener",
    "url",
    "version",
    "title",
    "items",
    "evaluation"
  ],
  "additionalProperties": false,
  "properties": {
    "$formspecScreener": {
      "type": "string",
      "const": "1.0",
      "description": "Screener specification version. MUST be '1.0'.",
      "examples": ["1.0"],
      "x-lm": {
        "critical": true,
        "intent": "Version pin for screener document compatibility. Processors MUST reject screeners with an unrecognized version."
      }
    },
    "url": {
      "type": "string",
      "format": "uri",
      "description": "Canonical, stable URI identifying this screener. MUST be globally unique. The pair (url, version) uniquely identifies a specific screener revision. Does not need to be a resolvable HTTP URL; URN syntax is acceptable.",
      "examples": [
        "urn:example:grants-eligibility-screener",
        "https://agency.gov/screeners/benefit-eligibility"
      ],
      "x-lm": {
        "critical": true,
        "intent": "Stable identifier of the screener across versions."
      }
    },
    "version": {
      "type": "string",
      "minLength": 1,
      "description": "Semantic version of this Screener Document, following semver 2.0.0. Independent of any Definition version.",
      "examples": ["1.0.0", "2.1.0-beta.1"],
      "x-lm": {
        "critical": true,
        "intent": "Screener revision identifier. Enables auditing which screener version produced a given Determination Record."
      }
    },
    "title": {
      "type": "string",
      "description": "Human-readable name for the screener.",
      "examples": [
        "Federal Grants Eligibility Screener",
        "Benefits Eligibility Navigator"
      ],
      "x-lm": {
        "critical": true,
        "intent": "Display name shown to respondents and in authoring tools."
      }
    },
    "description": {
      "type": "string",
      "description": "Purpose description for the screener.",
      "examples": [
        "Determines applicant eligibility and routes to the appropriate grant form.",
        "Evaluates household eligibility across all assistance programs."
      ]
    },
    "availability": {
      "$ref": "#/$defs/Availability",
      "description": "Calendar window during which the screener accepts new respondents. When omitted, the screener is always available."
    },
    "resultValidity": {
      "type": "string",
      "pattern": "^P(?:\\d+Y)?(?:\\d+M)?(?:\\d+W)?(?:\\d+D)?(?:T(?:\\d+H)?(?:\\d+M)?(?:\\d+S)?)?$",
      "description": "ISO 8601 duration declaring how long a completed Determination Record remains valid before re-screening is required. When omitted, the Determination Record has no expiration.",
      "examples": ["P14D", "P90D", "P1Y"]
    },
    "evaluationBinding": {
      "type": "string",
      "enum": ["submission", "completion"],
      "default": "submission",
      "description": "Determines which version of the screener's evaluation logic governs when the screener is updated between session start and completion. 'submission': rules at session start govern (default). 'completion': rules at completion govern."
    },
    "items": {
      "type": "array",
      "items": {
        "$ref": "https://formspec.org/schemas/definition/1.0#/$defs/Item"
      },
      "description": "Screening items. Uses the standard Formspec Item schema (core §4.2). Screener items are NOT part of any form's instance data — they exist only for routing classification. Item keys MUST be unique within the Screener Document.",
      "x-lm": {
        "critical": true,
        "intent": "The data collection elements of the screener. Same schema as Definition items but evaluated in an isolated scope."
      }
    },
    "binds": {
      "type": "array",
      "items": {
        "$ref": "https://formspec.org/schemas/definition/1.0#/$defs/Bind"
      },
      "description": "Bind declarations scoped to screener items. Uses the standard Formspec Bind schema (core §4.3). Paths reference screener item keys. These binds are evaluated in the screener's own scope — they do NOT interact with any Definition's binds."
    },
    "evaluation": {
      "type": "array",
      "items": {
        "$ref": "#/$defs/Phase"
      },
      "description": "Ordered evaluation pipeline. Phases execute in declaration order. Override routes are hoisted and evaluated before all phases.",
      "x-lm": {
        "critical": true,
        "intent": "The routing logic of the screener. Each phase declares a strategy and a set of routes."
      }
    },
    "extensions": {
      "type": "object",
      "propertyNames": {
        "pattern": "^x-"
      },
      "description": "Extension declarations. Uses the same extension mechanism as Definition (core §4.6)."
    }
  },
  "$defs": {
    "Availability": {
      "type": "object",
      "description": "Calendar window during which the screener accepts new respondents. Either or both properties may be omitted for open-ended windows.",
      "properties": {
        "from": {
          "type": "string",
          "format": "date",
          "description": "Earliest date (inclusive) on which the screener accepts respondents. If omitted, no start constraint.",
          "examples": ["2026-10-01"]
        },
        "until": {
          "type": "string",
          "format": "date",
          "description": "Latest date (inclusive) on which the screener accepts respondents. If omitted, no end constraint.",
          "examples": ["2026-12-31"]
        }
      },
      "additionalProperties": false
    },
    "Phase": {
      "type": "object",
      "description": "A single stage in the evaluation pipeline. Each phase declares a strategy that determines how its routes are evaluated. Phases execute in declaration order and produce independent results aggregated into the Determination Record.",
      "required": ["id", "strategy", "routes"],
      "properties": {
        "id": {
          "type": "string",
          "pattern": "^[a-zA-Z][a-zA-Z0-9_-]*$",
          "description": "Unique identifier for this phase within the Screener.",
          "examples": ["eligibility", "form-selection", "program-matching"]
        },
        "label": {
          "type": "string",
          "description": "Human-readable name for this phase.",
          "examples": ["Eligibility Check", "Level of Care Determination"]
        },
        "description": {
          "type": "string",
          "description": "Description of this phase's purpose."
        },
        "strategy": {
          "oneOf": [
            {
              "type": "string",
              "enum": ["first-match", "fan-out", "score-threshold"]
            },
            {
              "type": "string",
              "pattern": "^x-[a-z][a-z0-9]*(-[a-z][a-z0-9]*)*$",
              "description": "Module-contributed strategy per ADR 0150 §4.5/§4.9 (tightened from previous `x-.+` form to the canonical `^x-[a-z][a-z0-9]*(-[a-z][a-z0-9]*)*$` regex)."
            }
          ],
          "description": "Evaluation strategy. Normative closed-core values: 'first-match', 'fan-out', 'score-threshold'. Module extension strategies follow the canonical `^x-[a-z][a-z0-9]*(-[a-z][a-z0-9]*)*$` regex (ADR 0150 §4.5/§4.8).",
          "examples": ["first-match", "fan-out", "score-threshold", "x-constraint-satisfaction"],
          "x-lm": {
            "critical": true,
            "intent": "Determines how routes in this phase are evaluated. Core conformance requires 'first-match'. Complete conformance requires all three normative strategies. Module-extensible per ADR 0150 §4.5."
          }
        },
        "routes": {
          "type": "array",
          "items": {
            "$ref": "#/$defs/Route"
          },
          "description": "Routes to evaluate using this phase's strategy."
        },
        "activeWhen": {
          "$ref": "https://formspec.org/schemas/definition/1.0#/$defs/FELExpression",
          "description": "When present, the phase is evaluated only when this expression evaluates to true. When absent, the phase always evaluates."
        },
        "config": {
          "type": "object",
          "description": "Strategy-specific configuration. Normative strategies define their own config schemas. Extension strategies define their own.",
          "properties": {
            "minMatches": {
              "type": "integer",
              "minimum": 0,
              "description": "Fan-out: minimum routes that must match for success."
            },
            "maxMatches": {
              "type": "integer",
              "minimum": 1,
              "description": "Fan-out: maximum matched routes to include."
            },
            "topN": {
              "type": "integer",
              "minimum": 1,
              "description": "Score-threshold: return only the top N scoring routes."
            },
            "normalize": {
              "type": "boolean",
              "default": false,
              "description": "Score-threshold: when true, normalize scores to 0.0-1.0 range before threshold comparison."
            }
          },
          "additionalProperties": true
        }
      },
      "additionalProperties": false
    },
    "Route": {
      "type": "object",
      "description": "A single routing rule within an evaluation phase. Routes combine a condition or score expression with a target destination. Override routes are hoisted out of their phase and evaluated before all phases.",
      "required": ["target"],
      "properties": {
        "condition": {
          "$ref": "https://formspec.org/schemas/definition/1.0#/$defs/FELExpression",
          "description": "Boolean FEL expression evaluated against screener item values. Required for 'first-match' and 'fan-out' strategies.",
          "examples": [
            "moneyAmount($award_amount) < 250000",
            "$org_type = 'nonprofit'",
            "true"
          ]
        },
        "score": {
          "$ref": "https://formspec.org/schemas/definition/1.0#/$defs/FELExpression",
          "description": "Numeric FEL expression evaluated against screener item values. Required for 'score-threshold' strategy.",
          "examples": [
            "$locus_score",
            "if($neutrophil_count >= 2.5, 3, 0) + if($ecog_status <= 1, 3, 0)"
          ]
        },
        "threshold": {
          "type": "number",
          "description": "Minimum score required for this route to match (score >= threshold). Required for 'score-threshold' strategy."
        },
        "target": {
          "type": "string",
          "description": "Route destination URI. Four categories: (1) a Formspec Definition reference (url|version), (2) an external URI, (3) a named outcome (outcome:name), (4) a Surface route reference (surface:<route-id>) per ADR 0150 §7 — when the bundle includes a Surface document, a Screener terminal-hop with this scheme lands the respondent inside that Surface's route composition. The <route-id> after `surface:` MUST resolve to a route id in the bundle's Surface document.",
          "examples": [
            "https://grants.gov/forms/sf-425-short|1.0.0",
            "https://agency.gov/applications-closed",
            "outcome:ineligible",
            "outcome:review",
            "surface:home-new"
          ],
          "x-lm": {
            "critical": true,
            "intent": "Where the respondent is directed when this route matches. Four categories: Definition references, external URIs, named outcomes, and Surface route references (surface:<route-id>, per ADR 0150 §7)."
          }
        },
        "label": {
          "type": "string",
          "description": "Human-readable route description.",
          "examples": ["SF-425 Short Form", "Nonprofit Track"]
        },
        "message": {
          "type": "string",
          "description": "Human-readable message to display to the respondent when this route matches. MAY contain {{expression}} interpolation sequences.",
          "examples": [
            "Your household likely qualifies for SNAP benefits.",
            "Based on your responses, you do not meet the eligibility criteria."
          ]
        },
        "metadata": {
          "type": "object",
          "description": "Arbitrary key-value metadata attached to the route. Preserved in the Determination Record without interpretation by the processor.",
          "additionalProperties": true
        },
        "override": {
          "type": "boolean",
          "default": false,
          "description": "When true, this route is an override route. Override routes are hoisted out of their phase and evaluated before all phases."
        },
        "terminal": {
          "type": "boolean",
          "default": false,
          "description": "When true and the override matches, the entire evaluation pipeline halts. Ignored when 'override' is false."
        }
      },
      "additionalProperties": false
    }
  }
}
